{
  "schemaVersion": "1.0.0",
  "runId": "00000000-0000-0000-0000-000000000001",
  "status": "passed",
  "startedAt": "2026-08-18T00:00:00Z",
  "completedAt": "2026-08-18T00:05:00Z",
  "sourceCommit": "0000000000000000000000000000000000000000",
  "stack": "dotnet-sqlserver",
  "sourceDatabase": {
    "family": "sqlserver",
    "server": "localhost\\SQLEXPRESS",
    "database": "LegoCatalog",
    "engineVersion": "2022"
  },
  "targetDatabase": {
    "resourceId": "/subscriptions/00000000-0000-0000-0000-000000000000/resourceGroups/rg-mh-example/providers/Microsoft.Sql/servers/sql-example/databases/catalog",
    "family": "azure-sql",
    "server": "sql-example.database.windows.net",
    "database": "catalog",
    "authentication": "managed-identity",
    "localAdministratorPrincipal": null,
    "entraAdministratorPrincipal": null,
    "applicationPrincipal": {
      "name": "id-mh-example",
      "kind": "managed-identity",
      "principalId": "00000000-0000-0000-0000-000000000002"
    }
  },
  "databaseArtifact": {
    "format": "bacpac",
    "exportTool": {
      "name": "SqlPackage",
      "version": "170.4.83"
    },
    "importTool": {
      "name": "SqlPackage",
      "version": "170.4.83"
    },
    "sha256": "0000000000000000000000000000000000000000000000000000000000000000",
    "bytes": 1
  },
  "databaseVerification": {
    "migrationHistory": [
      "202608180001_ContractBaseline|8.0.22"
    ],
    "schemaVerified": true,
    "constraintsVerified": true,
    "indexesVerified": true,
    "seedManifestVersion": "1.0.0",
    "verifiedRowCounts": {
      "figures": 198,
      "categories": 20
    }
  },
  "images": {
    "resourceId": "/subscriptions/00000000-0000-0000-0000-000000000000/resourceGroups/rg-mh-example/providers/Microsoft.Storage/storageAccounts/stexample/blobServices/default/containers/catalog-images",
    "provider": "azure-blob",
    "location": "catalog-images",
    "authentication": "managed-identity",
    "verification": {
      "imageCount": 198,
      "imageBytes": 323011386,
      "imageSetSha256": "c706eda9b7d74a2b578b02487e6527e707819bc3cdd09adc59e3cb62ffcba7be",
      "seedManifestVersion": "1.0.0"
    }
  }
}
